{
  "version": 1,
  "description": "Narrative cue library for Lori follow-up selection. Listener aid only; never a truth source.",
  "no_truth_write": true,
  "cue_types": [
    {
      "cue_id": "parent_character_001",
      "cue_type": "parent_character",
      "label": "Parent character through action, body, silence, work, or gesture",
      "risk_level": "low",
      "trigger_terms": [
        "father",
        "mother",
        "dad",
        "mom",
        "hands",
        "apron",
        "silence",
        "work",
        "shoulder"
      ],
      "scene_anchor_dimensions": [
        "person",
        "object",
        "gesture"
      ],
      "safe_followups": [
        "What do you remember those hands doing?",
        "Where would you usually see that happen?",
        "What did that gesture mean in your family?"
      ],
      "forbidden_moves": [
        "Do not infer affection, coldness, trauma, or diagnosis unless the narrator names it.",
        "Do not turn a gesture into a protected fact.",
        "Do not write parent fields directly.",
        "Cue library is listener aid only; it must never write truth directly."
      ],
      "operator_extract_hints": [
        "parents.notes",
        "parents.occupation",
        "parents.notableLifeEvents"
      ],
      "runtime_exposes_extract_hints": false
    },
    {
      "cue_id": "elder_keeper_001",
      "cue_type": "elder_keeper",
      "label": "Grandparent or elder as keeper of memory, craft, rule, or story",
      "risk_level": "low",
      "trigger_terms": [
        "grandmother",
        "grandfather",
        "grandpa",
        "grandma",
        "oldest",
        "kept",
        "remembered",
        "taught"
      ],
      "scene_anchor_dimensions": [
        "person",
        "object",
        "ritual"
      ],
      "safe_followups": [
        "Where was that kept?",
        "Who taught you what it meant?",
        "What do you remember watching them do?"
      ],
      "forbidden_moves": [
        "Do not infer legal authority, religion, or family role beyond what was said.",
        "Do not promote elder details directly.",
        "Cue library is listener aid only; it must never write truth directly."
      ],
      "operator_extract_hints": [
        "grandparents.memorableStory",
        "greatGrandparents.memorableStories",
        "familyTraditions"
      ],
      "runtime_exposes_extract_hints": false
    },
    {
      "cue_id": "journey_arrival_001",
      "cue_type": "journey_arrival",
      "label": "Migration, arrival, move, first strange place, first home",
      "risk_level": "medium",
      "trigger_terms": [
        "arrived",
        "train",
        "ship",
        "wagon",
        "moved",
        "crossing",
        "first time",
        "new place",
        "border"
      ],
      "scene_anchor_dimensions": [
        "movement",
        "place",
        "time",
        "sensory"
      ],
      "safe_followups": [
        "What was the first thing that told you this place was different?",
        "What did you notice first when you arrived?",
        "Who was with you at that moment?"
      ],
      "forbidden_moves": [
        "Do not assume immigration status.",
        "Do not convert arrival scene into placeOfBirth.",
        "Do not overwrite residence fields.",
        "Cue library is listener aid only; it must never write truth directly."
      ],
      "operator_extract_hints": [
        "residence.place",
        "residence.period",
        "travel.destination",
        "cultural.touchstoneMemory"
      ],
      "runtime_exposes_extract_hints": false
    },
    {
      "cue_id": "home_place_001",
      "cue_type": "home_place",
      "label": "House, kitchen, porch, yard, neighborhood, room, shelter",
      "risk_level": "low",
      "trigger_terms": [
        "house",
        "home",
        "kitchen",
        "porch",
        "yard",
        "sod house",
        "room",
        "neighborhood",
        "door"
      ],
      "scene_anchor_dimensions": [
        "place",
        "object",
        "sensory"
      ],
      "safe_followups": [
        "Where in the house did that usually happen?",
        "Who else would have been there?",
        "What did that place feel like to you as a child?"
      ],
      "forbidden_moves": [
        "Do not treat a remembered home as place of birth.",
        "Do not invent address or residence period.",
        "Cue library is listener aid only; it must never write truth directly."
      ],
      "operator_extract_hints": [
        "residence.notes",
        "earlyMemories.firstMemory",
        "familyTraditions"
      ],
      "runtime_exposes_extract_hints": false
    },
    {
      "cue_id": "work_survival_001",
      "cue_type": "work_survival",
      "label": "Labor, duty, money, farm, factory, railroad, domestic work",
      "risk_level": "medium",
      "trigger_terms": [
        "worked",
        "factory",
        "farm",
        "railroad",
        "steel mill",
        "sharecropper",
        "field",
        "threshing",
        "debt",
        "wages"
      ],
      "scene_anchor_dimensions": [
        "work",
        "person",
        "sensory",
        "time"
      ],
      "safe_followups": [
        "What sound do you remember from that work?",
        "What did a hard day of that work look like?",
        "Who depended on that work?"
      ],
      "forbidden_moves": [
        "Do not decide whether this is narrator work or parent work without subject evidence.",
        "Do not infer class judgment or politics.",
        "Cue library is listener aid only; it must never write truth directly."
      ],
      "operator_extract_hints": [
        "parents.occupation",
        "education.earlyCareer",
        "education.careerProgression",
        "community.role"
      ],
      "runtime_exposes_extract_hints": false
    },
    {
      "cue_id": "hearth_food_001",
      "cue_type": "hearth_food",
      "label": "Food, recipes, kitchen ritual, table memory",
      "risk_level": "low",
      "trigger_terms": [
        "bread",
        "soup",
        "coffee",
        "onions",
        "kitchen",
        "canning",
        "lard",
        "garden",
        "Christmas",
        "Sunday",
        "collards",
        "ham bone"
      ],
      "scene_anchor_dimensions": [
        "sensory",
        "object",
        "ritual",
        "person"
      ],
      "safe_followups": [
        "Who usually made that?",
        "Was that everyday food, or did it belong to a special day?",
        "What smell comes back first when you remember it?"
      ],
      "forbidden_moves": [
        "Do not infer ethnicity, religion, poverty, or health from food.",
        "Do not turn recipe language into a confirmed family tradition without review.",
        "Cue library is listener aid only; it must never write truth directly."
      ],
      "operator_extract_hints": [
        "familyTraditions",
        "recipes",
        "faith.notes",
        "parents.notes",
        "grandparents.memorableStory"
      ],
      "runtime_exposes_extract_hints": false
    },
    {
      "cue_id": "object_keepsake_001",
      "cue_type": "object_keepsake",
      "label": "Keepsake, tool, document, photo, Bible, jar, ticket, shawl",
      "risk_level": "medium",
      "trigger_terms": [
        "kept",
        "ticket",
        "passport",
        "Bible",
        "jar",
        "ribbon",
        "shawl",
        "photo",
        "watch",
        "flute"
      ],
      "scene_anchor_dimensions": [
        "object",
        "person",
        "time"
      ],
      "safe_followups": [
        "Where was it kept?",
        "Who was allowed to touch it?",
        "What did that object mean in the family?"
      ],
      "forbidden_moves": [
        "Do not infer ownership or legal identity beyond stated words.",
        "Do not write identity fields from object mentions.",
        "Cue library is listener aid only; it must never write truth directly."
      ],
      "operator_extract_hints": [
        "additionalNotes.desiredStory",
        "personal.nameStory",
        "grandparents.memorableStory"
      ],
      "runtime_exposes_extract_hints": false
    },
    {
      "cue_id": "language_name_001",
      "cue_type": "language_name",
      "label": "Accent, changed name, old language, nickname, shame/pride",
      "risk_level": "medium",
      "trigger_terms": [
        "name",
        "called",
        "accent",
        "talk funny",
        "English",
        "German",
        "nickname",
        "changed my name"
      ],
      "scene_anchor_dimensions": [
        "language",
        "person",
        "emotion_named"
      ],
      "safe_followups": [
        "How did that name sound inside the family?",
        "Who used the old name?",
        "What did it feel like when people said it differently?"
      ],
      "forbidden_moves": [
        "Do not correct names.",
        "Do not infer legal name change unless explicitly stated.",
        "Do not write protected identity.",
        "Cue library is listener aid only; it must never write truth directly."
      ],
      "operator_extract_hints": [
        "personal.nameStory",
        "parents.preferredName",
        "siblings.preferredName"
      ],
      "runtime_exposes_extract_hints": false
    },
    {
      "cue_id": "identity_between_001",
      "cue_type": "identity_between",
      "label": "Belonging, assimilation, in-between identity, old/new world",
      "risk_level": "medium",
      "trigger_terms": [
        "American",
        "old country",
        "in-between",
        "ashamed",
        "belong",
        "hyphen",
        "too American",
        "too Russian"
      ],
      "scene_anchor_dimensions": [
        "emotion_named",
        "language",
        "movement"
      ],
      "safe_followups": [
        "When did you first feel that split?",
        "Who in the family felt it most strongly?",